{
  "schema_version": "1.0",
  "approval_id": "approval-42",
  "approval_kind": "production",
  "issued_at": "2026-10-10T03:00:00Z",
  "valid_until": "2099-01-01T00:00:00Z",
  "issuer_principal_id": "independent-approval-gateway",
  "domain_id": "factory-maintenance-a",
  "candidate": {
    "sha256": "sha256:c538170f890a70d04758c214d748eec06abd67c730b2efc3c49ea5f8b3100e06",
    "locator": "fixtures/operating-bundle-manifest.json",
    "media_type": "application/json",
    "display_version": "fixture-1"
  },
  "candidate_kind": "operating_bundle",
  "base_bundle_digest": "sha256:0c0e274d2c2d34804415f343b9cd444f643288289f6d734be92911b6ef125ca2",
  "expected_control_revision": 3,
  "gate_policy": {
    "sha256": "sha256:7b1cbcb6b9421f3920ac931bb7919f986883eb0c9af9f1d24bda21b4c54d24dd",
    "locator": "fixture:independent-gate-policy",
    "media_type": "application/octet-stream",
    "display_version": "fixture-1"
  },
  "evidence": [
    {
      "sha256": "sha256:2700b1e00c68783ed67f20d09f528430670f5c8de1a308209c1a802791762739",
      "locator": "fixtures/validation-evidence.json",
      "media_type": "application/json",
      "display_version": "fixture-1"
    }
  ],
  "authority_delta": {
    "assessment": "expansion_detected",
    "assessment_artifact": {
      "sha256": "sha256:a2d49aff0c3efaba27d72d38e96a5b461f8796b17ac5e3cc69ca29483396adc8",
      "locator": "fixture:authority-impact-analysis",
      "media_type": "application/octet-stream",
      "display_version": "fixture-1"
    },
    "comparison_scope": {
      "sha256": "sha256:0958e0e0f9add1bb67a5af277daeda49838e5e580aeb36533805f6770183d1d7",
      "locator": "fixture:bounded-maintenance-asset-population",
      "media_type": "application/octet-stream",
      "display_version": "fixture-1"
    },
    "new_permissions": [
      "Read diagnostic records for M17, M18, and controller C4 under a scoped grant; no reset or interruption permission is added."
    ],
    "removed_permissions": [],
    "undecided_cases": [],
    "required_grant_ids": [
      "grant-coordinated-diagnostic-read"
    ]
  },
  "authorized_grants": [
    {
      "grant_id": "grant-coordinated-diagnostic-read",
      "issuer_principal_id": "maintenance-policy-owner",
      "grant_artifact": {
        "sha256": "sha256:ae3f943fe7752554dd7dcfcfc978bd318d7cddd517fbb77a9478b558b3eaaf05",
        "locator": "fixture:independent-coordinated-diagnostic-read-grant",
        "media_type": "application/octet-stream",
        "display_version": "fixture-1"
      },
      "domain_id": "factory-maintenance-a",
      "scope_description": "Read diagnostic records for M17, M18, and C4; resets and interruptions require separate authorization covering affected assets.",
      "valid_until": "2099-01-01T00:00:00Z"
    }
  ],
  "scope": {
    "sha256": "sha256:b122c3be622238087143804114c6cb142e987a8d3c1de0f8bfb8a612f5b706ba",
    "locator": "fixture:production-approval-scope",
    "media_type": "application/octet-stream",
    "display_version": "fixture-1"
  },
  "budget": {
    "sha256": "sha256:f79c52e0838b2f4f11f977c776179f9c65e1da74d7ce79d35a55d6e0d21c59aa",
    "locator": "fixture:bounded-action-budget",
    "media_type": "application/octet-stream",
    "display_version": "fixture-1"
  },
  "decision": "approved",
  "decision_record": {
    "sha256": "sha256:8523d0c767a5b41bc03c32ebd46d2ff182c9ae2ea11acfaa8fba555497a7b533",
    "locator": "fixture:approval-decision-receipt",
    "media_type": "application/octet-stream",
    "display_version": "fixture-1"
  },
  "correlation_id": "change-42"
}
